{"$schema":"https://json-schema.org/draft/2020-12/schema","title":"evidence_manifest","type":"object","required":["session_id","producer_agent","status","evidence"],"properties":{"session_id":{"type":"string"},"producer_agent":{"type":"string"},"status":{"enum":["sufficient","insufficient","blocked"]},"evidence":{"type":"array"}}}

